{
  "$schema": "http://json-schema.org/draft-07/schema#",
  "$id": "docs/hbtrack/_governance/00_MODULE_RULES.schema.json",
  "title": "00_MODULE_RULES",
  "description": "JSON Schema Draft-07 for HB Track module delta governance documents. Sovereign fields (execution_phases, exit_codes, skip_policy, aggregation_policy, merge_policy, global_type_system, rule_sets) are blocked via additionalProperties=false.",
  "type": "object",
  "required": [
    "meta",
    "module_id",
    "module_waiver_policy"
  ],
  "additionalProperties": false,
  "properties": {
    "meta": {
      "type": "object",
      "required": [
        "schema_ref",
        "inherits_constitution",
        "module_id",
        "version",
        "status"
      ],
      "additionalProperties": true,
      "properties": {
        "schema_ref": {
          "type": "string"
        },
        "inherits_constitution": {
          "type": "string"
        },
        "module_id": {
          "type": "string"
        },
        "version": {
          "type": "string"
        },
        "status": {
          "type": "string"
        }
      }
    },
    "module_id": {
      "type": "string",
      "description": "UPPER-CASE in contracts (e.g. 'ATLETAS'). lower-case only in filesystem paths (e.g. '.../modulos/atletas/...'). This asymmetry is intentional."
    },
    "module_waiver_policy": {
      "type": "object",
      "required": [
        "additional_cannot_waive"
      ],
      "additionalProperties": false,
      "properties": {
        "additional_cannot_waive": {
          "type": "array",
          "items": {
            "type": "string"
          },
          "description": "Additional rule_ids that cannot be waived in this module (merged with engine cannot_waive)."
        }
      }
    },
    "extra_python_disposition": {
      "type": "object",
      "description": "extra_python_disposition e declarado explicitamente para checkers Python que nao tem entrada JSON no engine (PROMOTE/DEFER/REJECT). Chaves sao checker_ids; valores definem action e target_execution_phase.",
      "additionalProperties": {
        "type": "object",
        "required": [
          "action",
          "target_execution_phase"
        ],
        "additionalProperties": false,
        "properties": {
          "action": {
            "type": "string",
            "enum": [
              "PROMOTE_TO_CONSTITUTION",
              "DEFER",
              "REJECT"
            ]
          },
          "target_execution_phase": {
            "type": "string",
            "enum": [
              "PRE_PLAN",
              "POST_PLAN",
              "POST_EXECUTION"
            ]
          }
        }
      }
    }
  }
}