{
  "meta": {
    "schema_ref": "../../_governance/00_MODULE_RULES.schema.json",
    "inherits_constitution": "../../_governance/ENGINE_CONSTITUTION.json",
    "module_id": "ATLETAS",
    "version": "1.0.0",
    "status": "ACTIVE"
  },
  "module_id": "ATLETAS",
  "module_waiver_policy": {
    "additional_cannot_waive": []
  },
  "extra_python_disposition": {
    "check_diff_does_not_include_test_files": {
      "action": "PROMOTE_TO_CONSTITUTION",
      "target_execution_phase": "POST_EXECUTION"
    },
    "check_diff_migration_matches_schema_changes": {
      "action": "PROMOTE_TO_CONSTITUTION",
      "target_execution_phase": "POST_EXECUTION"
    },
    "check_diff_scope_is_within_declared_files": {
      "action": "PROMOTE_TO_CONSTITUTION",
      "target_execution_phase": "POST_EXECUTION"
    }
  }
}